According that none the United platinum by way,Europe hosting between stray from giant corporate sole,[0.10266017],-122.0439453125,-141.118896484375,-135.315673828125,-106.138671875,0.65475775394647,0.34524224605353016,0.2828566413818436,0.7171433586181564
According some of up again any of bin,Prix has scooped largest by total area equivalents,[0.12684211],-122.684326171875,-137.5810546875,-134.49365234375,-93.98046875,0.6224188417832501,0.3775811582167498,0.215548273232012,0.784451726767988
According faced each driving under house might as,Quite obviously other collapses or reaches page following,[0.13987389],-123.62158203125,-139.47216796875,-137.575439453125,-94.834228515625,0.6299103762821185,0.37008962371788146,0.20377865332825457,0.7962213466717454
Baby born within lieu leaning but lightly rewarded,According shrug it easier said there in Hong,[0.10269515],-145.366455078125,-125.82421875,-110.737060546875,-139.404541015625,0.34170671527793284,0.658293284722067,0.7138361692707186,0.2861638307292814
Electric signs poured otherwise toss when installations close,According hours a result in Hong and said,[0.15023413],-140.591552734375,-117.16796875,-91.141357421875,-127.27587890625,0.3130436702472815,0.6869563297527185,0.7599093291052786,0.24009067089472144
Island safari the maintaining of or miracles similar,According still trying for want to the sake,[0.118296],-143.5576171875,-114.975341796875,-103.701904296875,-126.7529296875,0.2770750860859322,0.7229249139140679,0.6759022200050467,0.32409777999495326
River services sacrifice aura lieu way asthma might,According behind closed due in Hong materials along,[0.09396061],-148.490234375,-126.330810546875,-115.121826171875,-138.642333984375,0.32223667800313904,0.677763321996861,0.6791728245607477,0.32082717543925227
According transcript is accused him a commentary are,Screen tearing happens band remarking the hesitation going,[0.12624319],-117.873291015625,-141.44140625,-131.157958984375,-100.94091796875,0.6879982412362639,0.3120017587637361,0.2761783511371681,0.7238216488628321
United front media endeavor became another rant entirely,According feeds mostly due largely one side rowing,[0.12259892],-139.34228515625,-121.029296875,-97.908935546875,-133.16748046875,0.35104408668499826,0.6489559133150017,0.7547764105473895,0.24522358945261052
According factors such between man trying in Hong,Iris Stuart recommends lieu abuser are obviously transitional,[0.10502812],-134.98193359375,-151.760986328125,-147.522216796875,-115.106689453125,0.6371429426458745,0.3628570573541256,0.26238697285557827,0.7376130271444217
