Janeiro restaurants lieu Dalai est lieu plethora plethora,The album instead blunts cordon Ruby Cate cunts,[0.72293765],-208.82373046875,-144.1474609375,-116.84056091308594,-363.0064239501953,0.10247029835662494,0.8975297016433752,0.9924122010929018,0.007587798907098174
The median household incomes skyrocket subculture subculture complexes,Janeiro Dalai Dalai makings Eiffel lieu Buenos Buenos,[0.79349043],-130.368896484375,-210.498046875,-362.0297164916992,-118.57469177246094,0.9363482968595972,0.0636517031404029,0.007934360416676275,0.9920656395833237
Cate ventilator Moses and the actress Cate morons,Janeiro est lieu plethora Covent shitload lieu plethora,[0.76619459],-138.009033203125,-212.19140625,-366.8154487609863,-123.16948699951172,0.9233692023564619,0.0766307976435381,0.008505648692237975,0.9914943513077622
Cate principals planner buyer is about it was,Hallows lieu forefront protons lieu plethora Alamos plethora,[0.79367734],-127.250244140625,-208.67333984375,-356.2249298095703,-121.91242980957031,0.938887371191569,0.06111262880843101,0.009422972135203026,0.9905770278647968
Janeiro plethora Dalai Staples lieu plethora Dalai plethora,Subscribe quarterbacks planner planner buyer soon as well,[0.77919489],-211.170654296875,-134.892578125,-116.1184196472168,-378.18368911743164,0.07180105520168559,0.9281989447983143,0.9926003089965405,0.007399691003459445
Janeiro plethora Dalai Dalai Dalai Dalai Dalai plethora,But let their contemporaries planner planner pageant hopefuls,[0.7802797],-213.747802734375,-135.7509765625,-120.84876441955566,-356.0511169433594,0.0680513036530197,0.9319486963469803,0.9907406686250069,0.009259331374993093
Janeiro quo millimetre lieu plethora lieu plethora plethora,Subscribe certifications certifications supervised fleshed out of them,[0.76541233],-213.172119140625,-135.899658203125,-144.74238204956055,-366.2736396789551,0.06960898038644069,0.9303910196135592,0.9869992064832572,0.013000793516742742
Cate Dante Gabriel Medina bulking Conte Verde islands,Janeiro est shitload lieu Dalai Mahal plethora plethora,[0.77000563],-134.197509765625,-210.126708984375,-348.2874984741211,-115.43653869628906,0.927414881797239,0.07258511820276109,0.009697610849711203,0.9903023891502889
Transcript and Cate Edwards firefighter planner the playoffs,Janeiro plethora Dalai Dalai Dalai Dalai Dalai plethora,[0.78682864],-135.08935546875,-213.747802734375,-373.28557205200195,-120.84876441955566,0.9333431528491407,0.0666568471508593,0.008122916453315253,0.9918770835466845
Janeiro shitload Covent shitload plethora Dalai Dalai plethora,Subscribe to be snowed insists Cate Johannes Fink,[0.77758262],-210.526123046875,-135.51171875,-107.75646591186523,-367.71043968200684,0.07467863048543504,0.9253213695145651,0.9937250051380672,0.006274994861932883
