Getting bogged patented modules bogged evidently been unsatisfactory,Alamos lieu quo quo lieu quo quo Boko,[0.791147],-116.778564453125,-200.624755859375,-381.04934215545654,-116.69557285308838,0.9354454954757107,0.06455450452428946,0.00808879778351508,0.9919112022164849
Maritime lore cavalry were bogged bogged Zack Ryder,Alamos Dalai Falun lieu imp lieu quo insofar,[0.75992774],-119.762451171875,-200.236328125,-324.0268211364746,-109.80725288391113,0.9286399980841218,0.0713600019158783,0.013689889081162183,0.9863101109188375
It was just messing unaccounted tallied dioxide emissions,Alamos imp Dalai Alamos Boko Falun lieu Dalai,[0.80053471],-114.9609375,-201.34619140625,-355.88398790359497,-115.25868225097656,0.9401654899871873,0.05983451001281263,0.008153648632217073,0.9918463513677829
The pair neutralize and precipitate unaccounted statewide office,Alamos Dalai Alamos imp Dalai Falun lieu Dalai,[0.85496522],-97.87939453125,-202.606201171875,-398.3958206176758,-121.91955375671387,0.9657530489407073,0.0342469510592926,0.008970112603106704,0.9910298873968937
Janeiro monoxide imp Dalai Alamos Falun lieu Dalai,Nor Tel been contacting people participated clue about,[0.75388425],-200.703369140625,-122.331787109375,-120.6823673248291,-338.33465671539307,0.07593181998827875,0.9240681800117214,0.9872053920072213,0.012794607992778553
Alamos imp Dalai lieu quo Falun lieu Dalai,Graf was singled bogged participated freelance cameraman determined,[0.76747531],-202.529541015625,-124.14013671875,-119.21957874298096,-358.9097328186035,0.07589195560632546,0.9241080443936743,0.9914580671013725,0.00854193289862747
Alamos Dalai lieu quo Boko Falun lieu Dalai,It gets so bogged muted ingenious participated sake,[0.7954408],-202.73046875,-117.196533203125,-119.539719581604,-357.04016733169556,0.061379908037258915,0.9386200919627409,0.9912748165412204,0.00872518345877972
They neutralize or blue spotlights illuminating information it,Alamos Dalai Falun Dalai Falun monoxide imp Dalai,[0.84337273],-100.5771484375,-199.2109375,-359.6136703491211,-112.49050235748291,0.958712408836716,0.041287591163283836,0.007459893086771565,0.9925401069132284
Alamos Falun lieu imp Dalai Dalai imp Dalai,Getting bogged us participated right of all time,[0.82383758],-201.33544921875,-107.633056640625,-120.62976169586182,-424.7467317581177,0.04798067405280771,0.9520193259471923,0.9912559533100858,0.008744046689914227
Getting bogged bogged us privately owned property rights,Alamos Dalai Falun Dalai Falun lieu Dalai Dalai,[0.81856617],-110.54638671875,-203.007080078125,-356.42663764953613,-121.29771709442139,0.9501780769118164,0.04982192308818349,0.00911033794055718,0.9908896620594424
