Did something like to share psilocybin Ming Scotia,Do your best to help overcomes Corrupt system,[0.21796096],-60.60428237915039,-105.12922286987305,-94.20005798339844,-47.62331008911133,0.7351305816480084,0.2648694183519915,0.20114365574141868,0.7988563442585813
Den och ich the end of the world,Homer announces disastrous acquiring Brezhnev and Jin suffrage,[0.31871394],-139.3323860168457,-61.84423828125,-43.46653747558594,-109.19215393066406,0.21887584509571503,0.7811241549042852,0.8552570165347664,0.14474298346523384
Beauty was fastest in evade Kurdistan predominant battery,Division of operations of the strata ventures corp,[0.33517623],-48.963539123535156,-139.32716751098633,-95.7919921875,-46.91035461425781,0.8451838910752346,0.15481610892476536,0.19211613851319853,0.8078838614868016
Demonstrators combustion car waste time restraints looms hard,Subscribe subscribers have the right to choose subscriber,[0.35346445],-55.267250061035156,-123.68991661071777,-103.91649627685547,-39.13153076171875,0.8005686504455012,0.1994313495544988,0.13312006332053314,0.8668799366794671
Harry specializes amuse speculating effortless and comfortable platonic,I och am sure that you no Sur,[0.27660747],-56.48822212219238,-123.77361869812012,-108.74134063720703,-52.95671081542969,0.794180340551922,0.20581965944807806,0.19568866491353984,0.8043113350864605
Test cricket therefore dart fragments plagued from Brezhnev,My little Kitty Cate naps in the morning,[0.3211722],-59.41588592529297,-141.04818725585938,-107.52810668945312,-45.0190544128418,0.7951300880079823,0.2048699119920176,0.1551267721110424,0.8448732278889577
He faced foreclosure fries with methamphetamine instead skyrocketed,The catalyst empowers you in capitalizing your investments,[0.3263915],-52.59992218017578,-126.09905624389648,-110.35778045654297,-49.098876953125,0.8171345632654496,0.1828654367345502,0.1713216085536355,0.8286783914463642
Mix psilocybin compared to playing in parallel hyphae,I och like to eat in the Tavern,[0.27177091],-56.096824645996094,-112.07154273986816,-96.48995971679688,-45.97088623046875,0.777775845084336,0.22222415491566427,0.18468359613978513,0.815316403860215
Past are three condensing lanes or evade Caucasus,There foreseen no other way to get och,[0.27011831],-52.0460205078125,-123.72747421264648,-92.27294158935547,-50.57122039794922,0.8172961404401891,0.18270385955981097,0.22606768949360093,0.773932310506399
A few psilocybin beleaguered globular cocoa their lead,Bae och qui took it out last year,[0.27030493],-65.14860916137695,-145.74262809753418,-118.52162170410156,-52.5208625793457,0.7679270652657475,0.2320729347342527,0.17696830926299842,0.8230316907370014
