So because makes everyone bet about your life,In this point metric ton of the world,[0.31310658],-122.64111328125,-99.669677734375,-41.689465045928955,-61.39568567276001,0.14835377093268032,0.8516462290673197,0.779752931497936,0.22024706850206394
Fast itself that the unemployment system did not,But now and ambient temperature is that it,[0.31848606],-120.509521484375,-100.732666015625,-39.438037633895874,-64.76998853683472,0.17117775764785034,0.8288222423521497,0.8096954343237984,0.19030456567620158
What pleases the whole edge of white pounds,I was the street corner of evoking cheers,[0.30175909],-122.410400390625,-101.56884765625,-41.10429763793945,-66.57274532318115,0.1695698762177462,0.8304301237822537,0.7920057152116461,0.20799428478835383
Asked whether or pertaining to make a year,Once not knowing why to increase a copy,[0.36265313],-94.304443359375,-120.078369140625,-62.3151593208313,-41.61143255233765,0.8880714522864185,0.1119285477135815,0.21624898616599889,0.7837510138340011
A lot of things other that the country,A lot of prof knows doing your best,[0.35317959],-100.757080078125,-122.737548828125,-61.79526972770691,-37.167248487472534,0.8404140524976818,0.15958594750231825,0.17106385646483635,0.8289361435351638
The match at some of about the way,The state upheld its indication by the other,[0.35730473],-98.87451171875,-120.54931640625,-63.038291454315186,-38.00892162322998,0.8494401004439656,0.15055989955603447,0.1768570962081815,0.8231429037918185
If this importantly I never got so decent,The other things I never have any typos,[0.31890576],-122.0693359375,-100.78466796875,-39.55218267440796,-60.79299068450928,0.1620346815312664,0.8379653184687336,0.8004616647771233,0.1995383352228767
I also do end up paying health attention,If you to pick up in solidarity payments,[0.35751463],-120.542724609375,-100.230712890625,-36.40041542053223,-62.9948525428772,0.16521335132930054,0.8347866486706994,0.8383190487125943,0.16168095128740564
It was a different from ruining the world,Kennel is a good moment down the road,[0.32582426],-97.06591796875,-121.613525390625,-87.97162222862244,-43.273757219314575,0.8731344136400528,0.12686558635994719,0.23304253890054147,0.7669574610994586
Just like something that it in Australia batted,So hey I think your freshman page game,[0.36816028],-100.71826171875,-123.67431640625,-62.02487754821777,-36.085047245025635,0.8424488111251446,0.15755118887485542,0.16039298877416605,0.8396070112258338
