According contributed to step with regard numerous references,She has to go with her numerous lies,[0.01790678],-124.5810546875,-107.266357421875,-132.539794921875,-92.2265625,0.3587123128361015,0.6412876871638986,0.2166282652408535,0.7833717347591465
According they first Gulf of the sake did,Not really a fan of the stadium food,[0.03297982],-115.5693359375,-106.382080078125,-125.085205078125,-86.2265625,0.4235398452829785,0.5764601547170215,0.22460250778244725,0.7753974922175529
According contributed to deal of the sake did,Expecting it to continue with the red wave,[0.04076664],-112.74755859375,-114.3017578125,-122.858642578125,-93.498291015625,0.5130340000865826,0.4869659999134173,0.2816722394856897,0.7183277605143101
According these kinds hours a ceremony took center,Made these after getting a burst of inspiration,[0.02876427],-127.6201171875,-121.574462890625,-136.858154296875,-103.941650390625,0.4494609440711497,0.5505390559288502,0.25930710060944673,0.7406928993905534
According if you earlier this was able either,Why did you think this was with sharing,[0.02377187],-116.786376953125,-106.872802734375,-126.257568359375,-91.34619140625,0.4176011631654661,0.582398836834534,0.24727825576391826,0.7527217442360816
I were no idea for lack there needs,I have no idea why they changed it,[0.03836228],-107.713134765625,-97.66064453125,-115.796630859375,-73.225341796875,0.4164679897074365,0.5835320102925635,0.20465916937558062,0.7953408306244194
Tristan dying mid can counsel some choice engravings,Yeah dying cards can do some fun things,[0.02796818],-142.7822265625,-122.4228515625,-106.7685546875,-110.537109375,0.33556640534701504,0.6644335946529849,0.5300048631429254,0.46999513685707445
According pleaded not the United for up out,I will mourn the loss of that patio,[0.04194048],-118.72314453125,-112.1572265625,-132.04833984375,-92.2919921875,0.44514536551163186,0.5548546344883681,0.21965675864297715,0.7803432413570227
Very large corporations have cloaked terrorize schools too,mainly large corporations have their servers there too,[0.02114404],-129.703857421875,-123.902587890625,-94.67919921875,-110.2734375,0.4514907813730274,0.5485092186269727,0.6218097119731313,0.3781902880268688
According shrug it were brought with regard me,Just saying it only works with Blue Tooth,[0.03465266],-118.827392578125,-122.10400390625,-129.6845703125,-104.896484375,0.5274572627135228,0.47254273728647717,0.31208473435567013,0.6879152656443299
