Fox got the shit end of this deal,Angeles got the fun end of their stick,-15.5703125,-47.51213250732422,-47.09963732910156,-115.683837890625,-131.254150390625
You too will come to know space gradually,You first can choose from full space marshal,-8.81884765625,-53.158925598144535,-53.12337908935547,-122.13232421875,-130.951171875
As far as the feet go surf more,As long as their feet go aground tightly,-8.79736328125,-52.35169757080078,-52.29543218994141,-116.97998046875,-125.77734375
Yeah I put it in my queue too,I absolutely took it in my midst too,-11.8154296875,-42.78182336425781,-41.85417230224609,-111.644287109375,-123.459716796875
I want them both next to each other,I gave you anything worthless to each other,-10.05078125,-37.81155548095703,-37.71137231445312,-102.4990234375,-112.5498046875
Wow that white chick is a slow learner,Cup when blue fries was the easiest denominator,-26.8857421875,-55.5810087890625,-55.52835174560547,-116.66748046875,-143.55322265625
You can mod and still keep the look,It could fruition and even keep the monkey,-8.3359375,-47.87847180175781,-47.49392059326172,-111.118408203125,-119.454345703125
You are quiet but you think a lot,You are careful but you was a problem,-4.722412109375,-40.729786865234374,-40.72203729248047,-103.815185546875,-108.53759765625
I see The King and the Kings Uncle,I met The Hague when the ambassador toyed,-14.064208984375,-54.52861950683594,-54.440361328125,-117.234619140625,-131.298828125
How to fight is not obvious at all,How the sin was not unfortunate at all,-9.689453125,-41.858310607910155,-41.800068603515626,-107.193359375,-116.8828125
