I saw him posting about a year ago,I saw him having about a year ago,-0.10365676879882812,-31.341917037963867,-31.241640090942383,-42.90570831298828,-43.00936508178711
Or maybe it would have been much worse,Or maybe it would have been much better,-0.7647686004638672,-26.490772247314453,-25.971168518066406,-28.93100929260254,-29.695777893066406
He did touch the shot but not enough,I would classify the tutorial but not easy,-17.746368408203125,-43.27083969116211,-43.26192665100098,-47.72257995605469,-65.46894836425781
Wow now this is some stupid ass shit,Seriously and this made some rough ass posts,-40.63964080810547,-48.513885498046875,-48.23101043701172,-48.659706115722656,-89.29934692382812
Only sub I thought it would fit in,Most grader I think it would cost me,-11.441181182861328,-44.690574645996094,-44.54092216491699,-48.73129653930664,-60.17247772216797
A bit hidden in a late game area,Another jaded highschool in my late game recently,-32.68174743652344,-52.4453239440918,-51.00362777709961,-55.334564208984375,-88.01631164550781
Nobody would know what to make of it,Nobody can see what to say about it,-8.674467086791992,-28.80548095703125,-27.977436065673828,-28.759183883666992,-37.433650970458984
just suck it up and heal the tank,Definitely check it up and accepted the sidebar,-22.315231323242188,-43.43263626098633,-43.176631927490234,-44.75914764404297,-67.07437896728516
None of the tests even check for that,Much of the layoffs resulted check for her,-25.231998443603516,-43.4249153137207,-42.213626861572266,-41.95822525024414,-67.19022369384766
One more reason to hate the drum shotgun,For little reason to skim my enchants autoimmune,-49.358673095703125,-52.254878997802734,-52.15376281738281,-48.19145202636719,-97.55012512207031
