She was a lady of beautiful words then,She was a apologised and beautiful conscience door,-33.07194519042969,-46.031638383865356,-45.80744910240173,-40.95128631591797,-74.02323150634766
He was an asshole in everything he did,That is an atheist and everyone I wanted,-23.040523529052734,-35.40606069564819,-34.83879804611206,-31.167827606201172,-54.208351135253906
You can probably get a job most anywhere,You may probably have a job calories haha,-31.430068969726562,-42.25264930725098,-42.09174299240112,-42.257118225097656,-73.68718719482422
It appears that you are asking a question,It felt that we are offered you use,-25.745243072509766,-37.85294008255005,-37.82603168487549,-33.0019645690918,-58.74720764160156
All I remember is her and the cancer,So I genuinely putting one or her highschool,-37.965606689453125,-46.57316017150879,-46.559393882751465,-43.75495910644531,-81.72056579589844
They both could have handled the situation better,We then even had enough the damage ethic,-40.94365310668945,-44.49886107444763,-44.417097091674805,-36.81223678588867,-77.75588989257812
But for me it has a different dimension,But although if it had a few gluten,-24.313465118408203,-39.71197438240051,-38.9963595867157,-39.33472442626953,-63.648189544677734
I see its value on a rational level,They believe its acquaintance on a lighthearted network,-31.714141845703125,-47.19056415557861,-47.13383769989014,-47.607643127441406,-79.32178497314453
I went home on leave for a funeral,I went home on fighting for a subscription,-12.170356750488281,-38.695539236068726,-38.62769675254822,-44.86809539794922,-57.0384521484375
Back hair is such a huge turn on,Keep carbohydrates is completely a shame slows school,-48.80488586425781,-54.48538112640381,-54.24129343032837,-50.36632537841797,-99.17121124267578
