I took a tab once many years ago,He Drew this Van once many years ago,-36.20548439025879,-46.88103485107422,-46.30419921875,-42.15134620666504,-78.35683059692383
That may have been a weird dream though,That could have been a waking dream memory,-9.398994445800781,-41.180946350097656,-40.279449462890625,-33.78848648071289,-43.18748092651367
Which is also how you get bog bodies,Which is also how we say Jun yuan,-60.06072998046875,-49.665863037109375,-49.50958251953125,-53.82668685913086,-113.88741683959961
At least the season itself has been good,At least the Rider that had been driving,-14.455892562866211,-42.20848083496094,-41.82525634765625,-42.54260063171387,-56.99849319458008
She literally will only hate on white women,It bloody sure do say married married wedding,-33.60791206359863,-56.540802001953125,-55.47754669189453,-52.00350379943848,-85.61141586303711
Looks like something you shit in the toilet,Looks like whatever you flushed in the toilet,-9.0069580078125,-41.47770309448242,-41.105560302734375,-43.98337364196777,-52.99033164978027
Hey bro thanks very much for the tip,Mia Mia very very much of the Tong,-53.840248107910156,-50.81922912597656,-49.85655212402344,-54.07416534423828,-107.91441345214844
Forces you to pay attention and work together,Forces people to pay attention and think think,-15.500190734863281,-46.431854248046875,-46.0123176574707,-46.53738021850586,-62.03757095336914
Ran over so many things in the desert,Loop about the individual words in a string,-20.95667266845703,-42.157196044921875,-41.98170471191406,-42.46959686279297,-63.42626953125
Not everyone is a native speaker of English,Somebody who is a great reader of english,-11.700754165649414,-37.12371063232422,-36.663429260253906,-38.854190826416016,-50.55494499206543
