14,I would love to visit my parents again,I would love to meet my daughter again,-3.66943359375,-24.611095428466797,-24.453510284423828,-77.92578125,-81.59521484375
43,But allowance are made for what is necessary,All regards are given as which is appropriate,-10.058349609375,-40.77760314941406,-40.60014343261719,-101.21435546875,-111.272705078125
144,The real motivation quote is in the comments,A partially captioned excerpt appears in the introduction,-24.0078125,-40.49217987060547,-39.75453186035156,-96.147705078125,-120.155517578125
157,No parent should have to go through that,Every parent will have to cope with that,-6.53173828125,-29.388763427734375,-28.786056518554688,-79.56103515625,-86.0927734375
162,Decided to actually pull the trigger this year,Hope to eventually pull the trigger next time,-8.915283203125,-37.61553192138672,-37.04719161987305,-90.403076171875,-99.318359375
195,You could see the oil was going bad,You could tell that Katrina was going bad,-5.505859375,-33.56193161010742,-32.9853630065918,-89.061767578125,-94.567626953125
213,He went back to work the next day,We went back to work the next day,-0.26611328125,-19.948040008544922,-19.632713317871094,-72.546875,-72.81298828125
244,I hope elections have more security than this,I hope elections have more outcomes than this,-8.613525390625,-40.92345428466797,-40.37792205810547,-100.941650390625,-109.55517578125
265,I rushed thru the first season without watching,I advent thru the last season of lent,-24.8505859375,-46.47306823730469,-46.17586135864258,-99.787841796875,-124.638427734375
311,But this is my first time seeing it,And this was my first time seeing him,-0.95263671875,-26.295528411865234,-24.285076141357422,-78.981689453125,-79.934326171875
325,They just make everything worse for the victim,They only make them worse for the victim,-1.478271484375,-34.13671875,-33.506256103515625,-87.535888671875,-89.01416015625
328,We are temporarily closed at this time though,They are technically unavailable at this time however,-8.581298828125,-34.93866729736328,-34.848846435546875,-89.32568359375,-97.906982421875
368,My saddle has started making a similar noise,My mailbox has started making some alarming noises,-15.552978515625,-44.86219787597656,-44.4227409362793,-104.3916015625,-119.944580078125
392,We got this from someone outside our Division,We accept mail from anywhere inside our mailbox,-19.670166015625,-38.87326431274414,-38.35775375366211,-98.873046875,-118.543212890625
479,Even the small time farmers are well off,Half the first generation olds were poorly educated,-18.319580078125,-40.454612731933594,-39.951541900634766,-91.36328125,-109.682861328125
482,I take my exam in exactly a week,I completed this application in exactly a month,-13.815673828125,-35.549957275390625,-34.881011962890625,-91.824462890625,-105.64013671875
524,A man comes over for a first date,A couple went here for a christmas visit,-25.20166015625,-33.04497528076172,-32.953338623046875,-82.733642578125,-107.935302734375
531,Yes this is what I am also asking,Or that is all I am really asking,-7.173095703125,-31.880043029785156,-31.549541473388672,-86.365478515625,-93.53857421875
586,You can look these things up when wondering,You can look these things up when wondering,0.0,-38.31752395629883,-38.31752395629883,-101.36669921875,-101.36669921875
604,I have seen a few request for this,We recently received a mail request for support,-13.150634765625,-32.218162536621094,-32.06459045410156,-87.646728515625,-100.79736328125
699,Someone who actually loves me and looks good,Someone who really wants life and feels good,-11.04541015625,-36.31121063232422,-36.06591033935547,-89.5166015625,-100.56201171875
799,Anyway thank you for giving context to this,Personally thank you for listening well to these,-7.80859375,-39.55061340332031,-39.046844482421875,-103.101806640625,-110.910400390625
837,This past week has been kind of bad,The past week has been kind of busy,-3.9775390625,-27.067426681518555,-26.813705444335938,-83.585205078125,-87.562744140625
876,I quit talking to him after hearing that,I finished talking to him after saying nothing,-6.76025390625,-32.460357666015625,-31.73239517211914,-86.653564453125,-93.413818359375
884,Take it or move to the next planet,Do not blindly steer in the next direction,-21.77734375,-35.166587829589844,-34.76182556152344,-86.154541015625,-107.931884765625
919,The area between New Orleans and Panama city,The border borders new Mexico and Panama city,-23.965087890625,-35.06085205078125,-34.792442321777344,-96.87939453125,-120.844482421875
934,But not for someone starting out playing solo,And especially with children fostered into Foster care,-25.826171875,-41.893951416015625,-41.71112823486328,-94.923828125,-120.75
942,I do this with English all the time,We do it to americans all the time,-9.126953125,-29.46833610534668,-29.07846450805664,-86.77880859375,-95.90576171875
945,This is the point of this entire thing,That is the point of this short article,-10.0947265625,-23.976530075073242,-22.5762882232666,-77.52783203125,-87.62255859375
975,Mary remained celebrate until her assumption into Heaven,Mary may proclaim forever her prides through communion,-27.40185546875,-60.64274215698242,-60.04241180419922,-113.257568359375,-140.659423828125
982,Just wait till they arrive back from China,So wait until you report back from tomorrow,-17.6669921875,-38.38025665283203,-38.13128662109375,-87.4765625,-105.1435546875
987,I think Rogue has an insane potential level,I believe Apollo has the optimum efficiency system,-15.099609375,-46.64878845214844,-46.52293395996094,-103.640869140625,-118.740478515625
990,Pretty often if you travel or visit relatives,Incredibly exciting if you travel and train abroad,-16.963623046875,-44.79401397705078,-44.572959899902344,-97.958984375,-114.922607421875
1075,I just get my friend to jump around,I still need my heart to kick high,-11.59814453125,-35.8511848449707,-35.1270751953125,-88.40380859375,-100.001953125
1095,He only wrote when he got the sentence,He only refused if I accepted the bribe,-15.05419921875,-36.42486572265625,-36.41595458984375,-92.5966796875,-107.65087890625
1280,He just needs to have been born there,He certainly happened to have been right here,-8.942138671875,-33.29907989501953,-33.20232009887695,-79.984375,-88.926513671875
1365,I can do perfectly fine without aim assist,I would do perfectly well doing alas no,-22.278564453125,-50.792606353759766,-50.75598907470703,-96.60986328125,-118.888427734375
1348,Bit he banged her head on that bench,Alas you propped your legs on another Cliff,-30.766845703125,-51.28828811645508,-51.1043586730957,-103.792724609375,-134.5595703125
1451,Someone feel free to educate me on this,She will happy to brief you on this,-18.052734375,-38.020328521728516,-37.9376335144043,-89.595703125,-107.6484375
1488,Sit with someone at lunch who is alone,Sit with someone at lunch who is bored,-1.4541015625,-42.72856903076172,-42.0194091796875,-107.548095703125,-109.002197265625
1470,I usually bring a flash for holiday parties,We always order a Taco for christmas dinners,-21.59814453125,-41.486366271972656,-40.473777770996094,-101.0419921875,-122.64013671875
1504,I will eat my shoe if this happens,I will empty my stomachs if this happens,-22.329345703125,-37.68755340576172,-36.682674407958984,-87.71826171875,-110.047607421875
1507,I remember like passing out from the pain,I almost remember breaking out from my cold,-16.988037109375,-38.83667755126953,-37.955692291259766,-88.933349609375,-105.92138671875
1627,Players have struggled because the collective is hurting,Players suffer injuries because their Fielding is sloppy,-12.613037109375,-47.379112243652344,-47.18292999267578,-108.739501953125,-121.3525390625
1724,I like the way you are taking this,I like the way people are describing things,-6.4296875,-27.95174217224121,-27.799053192138672,-81.075439453125,-87.505126953125
1136,I was planning to go there next Christmas,I was invited to live there last may,-7.130126953125,-29.63033103942871,-29.37077522277832,-86.681640625,-93.811767578125
1130,Saved me from having to find bolt cutters,Saving yourself from having to bake sugary cookies,-24.3134765625,-47.41926574707031,-47.1876220703125,-99.427978515625,-123.741455078125
1201,Really excited to finally see a live performance,Am pleased to finally announce this exciting announcement,-30.849853515625,-38.192169189453125,-38.13557434082031,-94.0810546875,-124.930908203125
1239,Completely ignoring the comments made by his girlfriend,Completely ignoring the arguments made by these critics,-6.32958984375,-38.30308532714844,-38.19694519042969,-87.59228515625,-93.921875
1276,Sounds like your gut is telling you something,Act like your heart is giving you life,-10.06396484375,-32.55360412597656,-32.43132019042969,-85.048828125,-95.11279296875
1842,I felt embarrassed for you just watching it,I felt guilty for stupidly not doing myself,-17.8037109375,-38.7623405456543,-38.7069091796875,-87.63232421875,-105.43603515625
1859,Now this is a fun format to watch,Now that is a fun blog to read,-9.348388671875,-30.739185333251953,-30.660200119018555,-89.048828125,-98.397216796875
1928,Every country has a set of common clothing,Our household needs a wardrobe of quality clothing,-23.134033203125,-39.34638214111328,-39.2195930480957,-92.2021484375,-115.336181640625
1883,This clip on its own shows one thing,This blog of my book teaches another lesson,-13.738525390625,-41.85301208496094,-41.77519226074219,-98.577880859375,-112.31640625
2020,Now go punch yourself in a parking lot,So simply park yourself in the Expo hall,-26.568115234375,-41.56735610961914,-41.283935546875,-91.7294921875,-118.297607421875
1954,If it looks and sounds like a dog,Sometimes something seems or feels like a coincidence,-27.009033203125,-34.05263900756836,-33.379852294921875,-77.598388671875,-104.607421875
2044,We have enough of all that you wanted,You control ownership of everything that is owned,-17.48486328125,-35.66416931152344,-35.61599349975586,-85.162841796875,-102.647705078125
2060,Same but I ran over my neighbors cat,Alas anyways I passed on my Guinea bug,-26.3330078125,-50.98204803466797,-50.803443908691406,-101.2109375,-127.5439453125
2090,That is an incredible ride and very fun,That was an exhausting ride and very fun,-8.092529296875,-35.07725524902344,-34.957305908203125,-90.46484375,-98.557373046875
2087,Head down is more of a defensive posture,Mental deterioration is much like a physical imbalance,-22.636474609375,-40.41466522216797,-40.34862518310547,-92.6396484375,-115.276123046875
2096,I think you replied to the wrong thread,I know they reply to the wrong email,-12.344482421875,-35.028106689453125,-34.9095573425293,-87.948486328125,-100.29296875
2147,No news agencies have reported on it either,No news agencies have reported on it either,0.0,-35.389801025390625,-35.389801025390625,-91.444580078125,-91.444580078125
2222,Try a solo public session in the future,Expect our next esp update in the fall,-22.232421875,-43.186424255371094,-42.853721618652344,-97.4208984375,-119.6533203125
2223,Plus Wynn will be back at some point,Las Ciudad will be closed at some point,-11.72314453125,-40.09552001953125,-39.834693908691406,-96.591552734375,-108.314697265625
2235,The war will be seen as a disaster,The war should be seen as a disaster,-1.23388671875,-27.520116806030273,-27.347640991210938,-82.613525390625,-83.847412109375
2267,This seems like a completely made up story,That seems like a good moving forward strategy,-14.3251953125,-32.55747985839844,-32.45014190673828,-84.556640625,-98.8818359375
2329,My cats bring me these things almost daily,My cats feed me these treats almost daily,-10.221435546875,-38.90809631347656,-38.7554931640625,-104.40966796875,-114.631103515625
2351,I had a vein rupture in my leg,I suffered a Major bruise in my toe,-9.8955078125,-33.965858459472656,-33.82655334472656,-97.890380859375,-107.785888671875
2415,I am fully behind the new player experience,I begin today researching my new York hometown,-37.38623046875,-44.26482009887695,-43.307594299316406,-84.946044921875,-122.332275390625
2443,The son was not able to practice either,Our partner was not able to respond successfully,-13.907470703125,-34.5655517578125,-33.43366241455078,-89.798828125,-103.706298828125
2462,Give their intake team a call for help,Gave our mediation committee a call to help,-11.343505859375,-46.63555908203125,-46.299591064453125,-108.34814453125,-119.691650390625
2470,Thanks for the advice and wish me luck,Thanks for the comments and wish us luck,-9.87646484375,-30.844057083129883,-30.797760009765625,-88.02099609375,-97.8974609375
2139,We have to get a stop on defense,We decided to rent a Booth across town,-14.84619140625,-33.55714416503906,-33.1061897277832,-84.21533203125,-99.0615234375
2182,Thanks for being what we all aspire to,And that dictates what we become used to,-9.308349609375,-36.35054016113281,-36.261505126953125,-85.236328125,-94.544677734375
2475,Some have some spots and occasionally a hair,Children have bald teeth and tend young hair,-28.783935546875,-46.27964782714844,-45.93690490722656,-98.858642578125,-127.642578125
2498,Tell us a bit more about your trip,Tell us a bit more about your trip,0.0,-29.419452667236328,-29.419452667236328,-84.181396484375,-84.181396484375
2523,Let us know if it works like that,Let us know if it works like that,0.0,-28.042335510253906,-28.042335510253906,-77.8466796875,-77.8466796875
2542,Looks like a homemade air dam to me,Is really a Mini est Opus to me,-22.94970703125,-48.615028381347656,-48.2802734375,-103.159423828125,-126.109130859375
2554,That is not right to encourage someone addiction,Which is very tough to boast for secondly,-16.20068359375,-44.462120056152344,-43.99151611328125,-96.361328125,-112.56201171875
2574,Best thing it ever did in its life,Best thing it ever did in its life,0.0,-35.14803695678711,-35.14803695678711,-94.936279296875,-94.936279296875
2582,Never tried who knows what is the result,Nobody looked but knew what caused the lull,-15.60205078125,-44.364654541015625,-43.71100616455078,-92.531005859375,-108.133056640625
2597,Not the best hat for camping in grass,Use the used yarn when knitting in advent,-27.95947265625,-48.2403564453125,-47.742576599121094,-103.895263671875,-131.854736328125
2716,Maybe he was speaking French the whole time,Actually I was studying english the entire time,-10.857666015625,-34.64725112915039,-34.18492126464844,-90.125732421875,-100.9833984375
2735,This could be an insult or a compliment,This could be an insult or a compliment,0.0,-27.81266975402832,-27.81266975402832,-88.396728515625,-88.396728515625
2742,No need for rust installed on your system,No charge for cleaners sold with this product,-16.26123046875,-42.52049255371094,-42.45474624633789,-98.517333984375,-114.778564453125
2867,Thanks will his price increases after treasure hunt,Thanks thank Les quo to sir Sri Dalai,-51.658935546875,-67.31263732910156,-67.25626373291016,-115.6328125,-167.291748046875
2873,Actually man let me change what I said,Pac cats make me act who I am,-16.230224609375,-45.311683654785156,-45.15234375,-101.1572265625,-117.387451171875
2911,I could see him coming off the bench,I could see him coming off the stage,-0.2392578125,-26.223112106323242,-26.17037010192871,-78.462646484375,-78.701904296875
2947,Your friend is an evil yet funny person,This character is an inexperienced yet feisty protagonist,-18.853271484375,-42.493492126464844,-41.966190338134766,-96.991943359375,-115.84521484375
2989,Suddenly the Taco Bell slogan makes complete sense,Even cheap Taco con cons make great meals,-34.464111328125,-53.51057434082031,-52.820396423339844,-105.149658203125,-139.61376953125
2844,It depends on the woman and her genetics,Life depends on the father and the motherhood,-18.502197265625,-34.427398681640625,-33.70408630371094,-87.026123046875,-105.5283203125
3004,It was funny and got the point across,It was good and got the point across,-0.718017578125,-28.337905883789062,-28.29916763305664,-83.177490234375,-83.8955078125
3018,The drive to do all this is power,The necessity to do exactly this is Paramount,-12.984130859375,-33.94568634033203,-32.824825286865234,-88.447509765625,-101.431640625
3063,You are probably seeing people play the beta,You are constantly seeing people play the multi,-15.00341796875,-45.39871597290039,-44.789306640625,-92.156982421875,-107.160400390625
3069,There is a setting that doubles the timers,There is no fraction that doubles a multi,-20.160400390625,-43.05317687988281,-41.59320831298828,-98.130615234375,-118.291015625
3106,Thank you finally someone who agrees with me,Disclaimer for contacting anyone who interacts with you,-21.79443359375,-39.71089553833008,-39.49017333984375,-89.658935546875,-111.453369140625
3137,And psychiatric doctors tend to take things seriously,And professional entrepreneurs tend to take business seriously,-19.21533203125,-39.174049377441406,-38.8714599609375,-99.283447265625,-118.498779296875
3114,I love switching up and playing all legends,I love sizing out and learning different purports,-22.081787109375,-49.960227966308594,-49.31843566894531,-102.76904296875,-124.850830078125
3139,There are limits to free speech as well,There are limits to free speech as well,0.0,-28.777389526367188,-28.777389526367188,-78.396240234375,-78.396240234375
3189,It helped me a lot at the time,It helped me a lot at the time,0.0,-22.793594360351562,-22.793594360351562,-77.14404296875,-77.14404296875
14,I would love to visit my parents again,I would love to meet my husband again,-3.322265625,-24.611093521118164,-24.01240348815918,-77.92578125,-81.248046875
3309,That is still running away from his consequences,That is no take away of true Zen,-19.369140625,-41.28925323486328,-40.98353576660156,-91.7978515625,-111.1669921875
